{
  "silo_id": "SILO-ELP-0001",
  "silo_name": "Earth Lights Phenomena",
  "source_node": "JOHN_CARTER_ROOT",
  "fibonacci_level": 5,
  "geometry": {
    "spiral_angle_degrees": 137.5,
    "golden_ratio_position": 1.618,
    "polar_coordinates": {
      "r": 5.0,
      "theta": 2.356
    },
    "containment_bounds": {
      "max_sub_nodes": 8,
      "max_depth": 3
    }
  },
  "ontology": {
    "domain_definition": "Luminous atmospheric and subterranean phenomena associated with geological stress, piezoelectric discharge, and telluric current anomalies",
    "scope_boundary": "Excludes artificial illumination, astronomical objects, and conventional meteorological lightning. Includes Hessdalen, Brown Mountain, La Pe\u00f1a de Juaica.",
    "disciplinary_parents": [
      "Atmospheric Physics",
      "Geophysics",
      "Plasma Science",
      "UAP Studies"
    ],
    "keywords": [
      "earth lights",
      "piezoelectric",
      "telluric",
      "p-hole",
      "Hessdalen",
      "Brown Mountain",
      "plasma"
    ],
    "established_date": "2026-01-15"
  },
  "corpus": {
    "core_theories": [
      {
        "id": "T-001",
        "name": "Piezoelectric Charge Generation Hypothesis",
        "status": "active",
        "confidence": 0.78
      },
      {
        "id": "T-002",
        "name": "P-Hole Pathway Diversity Model",
        "status": "developing",
        "confidence": 0.65
      }
    ],
    "verified_findings": [
      {
        "id": "F-001",
        "description": "Correlation between quartz-bearing rock stress and luminous event frequency in Hessdalen",
        "citation": "Project Hessdalen 2024"
      }
    ],
    "bibliography": [
      "Teodorani et al. 2024",
      "Project Hessdalen Annual Report 2025"
    ]
  },
  "research_inventory": {
    "completed_studies": [
      {
        "id": "S-001",
        "title": "Comparative Geological Survey: Brown Mountain vs Hessdalen",
        "date": "2025-11-20"
      }
    ],
    "datasets_catalogued": [
      {
        "id": "D-001",
        "name": "Hessdalen Spectroscopy Logs 2024-2025",
        "size": "2.4GB",
        "format": "FITS"
      }
    ],
    "instruments_used": [
      "Spectrometer",
      "Magnetometer",
      "Seismic Array",
      "EMF Logger"
    ],
    "methodologies": [
      "Long-duration monitoring",
      "Comparative site analysis",
      "Spectral decomposition"
    ]
  },
  "gap_analysis": {
    "research_gaps": [
      {
        "gap_id": "G-R-001",
        "description": "No real-time p-hole conductivity mapping exists for La Pe\u00f1a de Juaica",
        "severity": "critical",
        "blocking_dependencies": [
          "Local geological survey access",
          "Colombian research partnership"
        ],
        "estimated_closure_complexity": "high"
      },
      {
        "gap_id": "G-R-002",
        "description": "Lack of standardized spectral signature database across all three sites",
        "severity": "major",
        "blocking_dependencies": [
          "Data format harmonization"
        ],
        "estimated_closure_complexity": "medium"
      }
    ],
    "rd_gaps": [
      {
        "gap_id": "G-D-001",
        "description": "Need portable high-sensitivity p-hole detector for field deployment",
        "required_technology": "Solid-state electrochemical sensor array with GPS tagging",
        "required_funding_estimate": "$45,000 CAD",
        "timeline_to_close": "8-12 months"
      }
    ],
    "closure_pathways": [
      {
        "pathway_id": "P-001",
        "target_gap_ids": [
          "G-R-001",
          "G-D-001"
        ],
        "steps": [
          "Establish Colombian contact",
          "Secure field funding",
          "Deploy sensor array",
          "Collect 90-day baseline"
        ],
        "required_resources": [
          "Travel budget",
          "Spanish translator",
          "Local guide"
        ],
        "responsible_entity": "John Carter / Project Hessdalen liaison"
      }
    ]
  },
  "human_capital": {
    "profound_thinkers": [
      {
        "name": "Dr. Massimo Teodorani",
        "role": "Plasma physicist",
        "institution": "Independent",
        "contribution_type": "Spectral analysis methodology",
        "brilliance_rating": 10
      },
      {
        "name": "Dr. Erling Strand",
        "role": "Project Hessdalen lead",
        "institution": "\u00d8stfold University",
        "contribution_type": "Long-term monitoring infrastructure",
        "brilliance_rating": 9
      }
    ],
    "groundwork_operatives": [
      {
        "name": "Hessdalen Automatic Station",
        "role": "24/7 monitoring",
        "current_project": "Real-time anomaly detection",
        "needs": [
          "Upgraded camera array",
          "Faster internet uplink"
        ]
      }
    ],
    "needed_expertise": [
      "Colombian geologist with quartz deposit knowledge",
      "Spanish-language documentary researcher",
      "Plasma spectroscopist"
    ]
  },
  "line_items": [
    {
      "item_id": "LI-ELP-001",
      "title": "Map quartz vein density across La Pe\u00f1a de Juaica summit",
      "priority": 10,
      "status": "proposed",
      "parent_silo": "SILO-ELP-0001",
      "data_requirements": [
        "Geological survey maps",
        "Drone LiDAR",
        "Sample assay results"
      ],
      "output_target": "3D geological model with piezoelectric potential index",
      "submissions": []
    },
    {
      "item_id": "LI-ELP-002",
      "title": "Correlate white wolf/white horse/standing bear symbols with earth light folklore across all three sites",
      "priority": 8,
      "status": "active",
      "parent_silo": "SILO-ELP-0001",
      "data_requirements": [
        "Indigenous folklore archives",
        "Colonial records",
        "Comparative mythology database"
      ],
      "output_target": "Symbolic correlation matrix",
      "submissions": []
    }
  ],
  "metadata": {
    "last_updated": "2026-05-31T13:13:00Z",
    "version": "2.1.0",
    "curator": "John Carter",
    "access_level": "private"
  }
}